path,rule_id,profile_id,severity,tag,keyword,value_state,message,recommendation,standard_refs
examples/multiqc/output/dicom/private_tags.dcm,research-release-v0.1.private_tags.present,research-release-v0.1,warning,,PrivateTags,present,1 private DICOM tag(s) are present.,"Review vendor-specific private tags before release; private tags can contain site, protocol, or operator identifiers.",
examples/multiqc/output/dicom/raw_phi.dcm,research-release-v0.1.direct_phi.PatientBirthDate,research-release-v0.1,error,"(0010,0030)",PatientBirthDate,present,PatientBirthDate is populated and may contain direct PHI.,Remove this value or verify that the upstream anonymizer removes it for research release.,
examples/multiqc/output/dicom/raw_phi.dcm,research-release-v0.1.pseudonym_format.PatientID,research-release-v0.1,warning,"(0010,0020)",PatientID,present,PatientID is populated but does not match the built-in research pseudonym pattern.,"Use a non-identifying research identifier such as sub-001, SUBJ001, participant-123, or anon-001.",
examples/multiqc/output/dicom/raw_phi.dcm,research-release-v0.1.pseudonym_format.PatientName,research-release-v0.1,warning,"(0010,0010)",PatientName,present,PatientName is populated but does not match the built-in research pseudonym pattern.,"Use a non-identifying research identifier such as sub-001, SUBJ001, participant-123, or anon-001.",
examples/multiqc/output/dicom/raw_phi.dcm,research-release-v0.1.private_tags.present,research-release-v0.1,warning,,PrivateTags,present,1 private DICOM tag(s) are present.,"Review vendor-specific private tags before release; private tags can contain site, protocol, or operator identifiers.",
